Sr.,Employee Code,Name of Employee , Basic,Grade Pay,DA 30%,HRA 20%,CLA,TA,WA,Oth
1,001401,Ms. Kavita Pramod Norton,18784,4700,,,240,800,,0
2,001402,Ms. Shital P. Kambale ,14752,4200,,,240,200,,0
3,001403,Swati Maruti Hole,13928,4200,,,240,200,,0
4,001404,Mrs. Suchita Suhas Dhekane,8881,4200,,,240,200,,0
5,001405,Mrs. Jyoti Amol Chaudhary,12500,0,,,0,,,
6,001406,Ms. Savita B. Kamthe   ,8064,1900,,,240,200,,0
7,001407,Ms. Meenakshi S. Kutti ,7458,1400,,,240,200,60,0
8,001408,Mrs. Shobha B. Bhosale,6343,1300,,,240,200,60,0
